{
  "schema": "codex-task-broker-run-request",
  "schema_version": 1,
  "mode": "mock_only",
  "task_id": "EXAMPLE-TASK-1",
  "task_revision": 1,
  "attempt": 1,
  "work_order_path": "C:\\example\\runs\\EXAMPLE-TASK-1\\work-order.json",
  "briefing_path": "C:\\example\\runs\\EXAMPLE-TASK-1\\briefing.json",
  "worktree_path": "C:\\example\\worktrees\\demo-project",
  "run_store_path": "C:\\example\\runs\\EXAMPLE-TASK-1",
  "base_sha": "0000000000000000000000000000000000000000",
  "briefing_sha256": "0000000000000000000000000000000000000000000000000000000000000000",
  "allowed_files": ["src/demo/widget.py", "tests/test_demo.py"],
  "forbidden_files": ["pyproject.toml"],
  "contributor": {
    "executable": "C:\\example\\tools\\mock-contributor.exe",
    "argv": ["--briefing", "C:\\example\\runs\\EXAMPLE-TASK-1\\briefing.json"],
    "timeout_seconds": 900,
    "environment_allow": ["PATH", "SYSTEMROOT"]
  },
  "verification_commands": [["py", "-3", "-m", "pytest", "-q"]]
}
